{
  "id": "alignment-research-center-arc-funding",
  "url": "https://futureoflife.org/wp-content/uploads/2025/06/FLI-2023-Annual-Report.pdf",
  "title": "Funding disclosure for Alignment Research Center (ARC)",
  "publisher": "See linked organization or funder publication",
  "published_at": null,
  "accessed_at": "2026-09-12"
}
