{
  "id": "model-evaluation-threat-research-metr-funding",
  "url": "https://metr.org/blog/2026-08-14-funding-update/",
  "title": "Funding disclosure for Model Evaluation & Threat Research (METR)",
  "publisher": "See linked organization or funder publication",
  "published_at": null,
  "accessed_at": "2026-09-12"
}
