{
  "id": "center-for-ai-safety-cais-funding",
  "url": "https://coefficientgiving.org/research/our-progress-in-2023-and-plans-for-2024/",
  "title": "Funding disclosure for Center for AI Safety (CAIS)",
  "publisher": "See linked organization or funder publication",
  "published_at": null,
  "accessed_at": "2026-09-12"
}
