{
  "id": "robust-intelligence-acquired-by-cisco-funding",
  "url": "https://blogs.cisco.com/news/fortifying-the-future-of-security-for-ai-cisco-announces-intent-to-acquire-robust-intelligence",
  "title": "Funding disclosure for Robust Intelligence (Acquired by Cisco)",
  "publisher": "See linked organization or funder publication",
  "published_at": null,
  "accessed_at": "2026-09-12"
}
