{
  "id": "redwood-research-funding",
  "url": "https://coefficientgiving.org/research/our-progress-in-2021-and-plans-for-2022/",
  "title": "Funding disclosure for Redwood Research",
  "publisher": "See linked organization or funder publication",
  "published_at": null,
  "accessed_at": "2026-09-12"
}
